{
  "$schema": "https://json-schema.org/draft/2020-12/schema",
  "type": "object",
  "additionalProperties": false,
  "required": ["target", "timestamp", "urls"],
  "properties": {
    "target": { "type": "string" },
    "timestamp": { "type": "string" },
    "urls": {
      "type": "array",
      "items": {
        "type": "object",
        "additionalProperties": false,
        "required": ["url", "source"],
        "properties": {
          "url": { "type": "string" },
          "method": { "type": "string" },
          "status": { "type": "integer" },
          "content_type": { "type": "string" },
          "source": { "type": "string" }
        }
      }
    },
    "forms": {
      "type": "array",
      "items": {
        "type": "object",
        "additionalProperties": false,
        "required": ["action"],
        "properties": {
          "action": { "type": "string" },
          "method": { "type": "string" }
        }
      }
    },
    "links": {
      "type": "array",
      "items": {
        "type": "object",
        "additionalProperties": false,
        "required": ["url"],
        "properties": {
          "url": { "type": "string" },
          "source": { "type": "string" }
        }
      }
    },
    "notes": {
      "type": "array",
      "items": { "type": "string" }
    },
    "evidence": {
      "type": "array",
      "items": {
        "type": "object",
        "additionalProperties": false,
        "required": ["kind", "path", "description"],
        "properties": {
          "kind": { "type": "string" },
          "path": { "type": "string" },
          "description": { "type": "string" }
        }
      }
    }
  }
}
